1382,挽回爱情，让对方主动找你复合的绝密技巧！,2020-01-05
1381,挽回的本质，以及如何挽回？,2019-12-14
1380,异地恋分手拒绝复合，99.8%的成功挽回都用这几招,2020-01-19
1379,从她说“再见”到“我愿意重新和你在一起”，我只用了23天！,2020-01-21
1378,“1”招逆转分手死局，让她秒回你，哭着对你说：复合吧,2019-12-12
1377,看了这篇挽回指南，分手了对方主动找你认错！,2020-01-15
1376,万能搭讪破冰技巧！！！,2020-01-05
1375,这“1”招直戳女人心，她再冷漠也会主动认错,2019-12-31
1374,教你这样破镜重圆，高效挽回爱情！,2019-12-18
1373,“3”招逆转分手死局，让你们的关系重回热恋,2020-01-05
1372,挽回困难不存在，他只用“四招”绝地大反转,2019-12-28
1371,分手后，学会这些高效挽回,2019-12-12
1370,关系遇冷？学会这1绝招，她再绝情也难以抗拒,2019-12-21
1369,掌握这五大阶段，让她重新爱上你,2019-12-21
1368,因“没感觉、不合适”导致分手，一招让女人倒贴挽回你,2019-12-17
1367,分手后不甘心，教你三招聊天技巧，迅速关系破冰！,2020-01-06
1366,教你起死回生的破冰聊天术,2019-12-28
1365,“破冰关系”四个技巧教你了解女性思维快速挽回！,2019-12-23
1364,对方绝情分手，教你成功逆转走向甜蜜婚姻！,2019-12-12
1363,各种场合破冰技巧，教你快速学会！,2019-12-12
1362,被动冷战，情侣之间如何巧妙破冰呢？,2020-01-14
1361,抓住核心问题，提升百分之九十挽回成功率,2019-12-25
1360,一字一句教会你，完美破冰术！,2020-01-08
1359,和女生聊天如何破冰，建立关系第一步你真会吗？,2019-12-28
1358,这些正确的聊天破冰方法，只要做到就能追到她！,2020-01-14
1357,只要用对这4招，再绝情的她也会找你复合,2020-01-09
1356,想让妹子喊你老公？,2019-12-12
1355,关系遇冷用这1招，她再绝情都难以抗拒,2019-12-17
1354,通过这样的聊天方式，妹子会依赖上你,2019-12-29
1353,从冷暴力到她温柔体贴，破冰的关键要这样做！,2020-01-07
1352,"99%男人不知女生这个软肋,15天让她主动挽回你",2019-12-08
1351,挽回这样聊，四个狠招让她主动求复合,2019-12-20
1350,这样和女孩聊天破冰，分分钟收获她芳心,2019-12-22
1349,挽回爱情，女导师教你写让关系破冰的“种子信”,2020-01-20
1348,3步扭转分手僵局，她再绝情也会忍不住求复合,2019-12-18
1347,总是被分手，只用一招让她主动挽回我！,2019-12-30
1346,15天从绝情分手到跪求认错，我只做了这三件事,2020-01-17
1345,最能戳中女人软肋的挽回4步法，再绝情她也会主动求复合,2019-12-27
1344,分手后的挽回必杀技，让她回心转意主动求和！,2020-01-15
1343,这篇文章值300万，老司机祖传挽回偏方,2019-12-29
1342,想要挽回爱情必须学会二次吸引！,2020-01-08
1341,挽回只要这四步，让绝情的她倒追你,2019-12-15
1340,拒绝聊天死，这样的破冰方式你值得拥有！,2020-01-18
1339,不要再死缠烂打，这才是最有效的挽回方式！,2020-01-19
1338,分手被拉黑？别放弃，用这个方法复联成功率极高,2020-01-15
1337,学会“关系破冰 ”，再高冷的女人也会爱上你,2020-01-18
1336,分手后痛苦难熬？学会这三招她会回心转意,2019-12-11
1335,教科书式的挽回女友操作,2019-12-12
1334,让死心的她主动求复合，只需这“1”狠招,2020-01-12
1333,狙击女神的核心“聊天”技巧,2020-01-10
1332,妹子这样撩，90%都会沦陷,2020-01-11
1331,被拉黑也别慌，情感大师教你如何复合,2020-01-20
1330,让妹子欲罢不能的聊天手法,2019-12-14
1329,情侣冷战怎么办？三招顺利破冰,2019-12-10
