1698,教你经营婚姻七个技巧，让你们感情越处越深,2020-01-02
1697,爆发性分手，对方态度非常决绝，依旧挽回！,2020-01-18
1696,懂得这些，你也可以成为婚姻感情中的“修复大师”,2020-01-13
1695,抓住三个挽回要点，让坚决离婚的她主动回来！,2020-01-16
1694,教你如何应对平淡的婚姻生活,2020-01-18
1693,婚姻经营之道：夫妻如何才能久看不厌,2020-01-12
1692,为什么你的老婆会出轨？,2020-01-04
1691,掌握这3个方法，离婚了都一样可以挽回,2019-12-22
1690,这一秘诀让老婆离不开你，主动对第三者说“滚”,2019-12-13
1689,感情中遭遇出轨，应该原谅她吗？,2020-01-03
1688,面对婚姻危机，掌握这几点就能高效挽回,2019-12-24
1687,想和旧情人重温鸳梦？别傻了，你会做噩梦！,2019-12-21
1686,教你如何正确的吵架,2019-12-11
1685,把婆婆当成妈，认真你就输了,2019-12-10
1684,房子和男人，什么才能给你终极安全感？,2020-01-15
1683,婚姻挽回率最高的“3”招，让她心疼你主动来挽回,2019-12-23
1682,别爱得太满，别睡得太晚,2019-12-11
1681,“拼孩”拼出婚外情， 我和大叔的婚姻悲剧了！,2019-12-09
1680,吵架是检验婚姻幸福与否的最好标准,2019-12-25
1679,抓准这两个挽回要点，让坚决离婚的她乖乖回来,2020-01-05
1678,这样挽救婚姻，让她马上想要回头依赖你,2019-12-10
1677,比头婚更不能凑合的是，再婚,2020-01-13
1676,爱情不是战争，何必势均力敌？,2019-12-24
1675,为什么男人对哥们儿比对老婆好？,2019-12-15
1674,深度解析婚姻关系，让你婚姻挽回成功率达到97.6％,2019-12-14
1673,谁的婚姻不曾枯萎？,2019-12-23
1672,荒唐“转正”协议， 我的“卖房买夫”计划终成空,2019-12-16
1671,结婚，你是认真的吗?,2019-12-28
1670,相亲相爱，就是一致对外,2019-12-21
1669,婚姻破裂不用怕，学会4招让你们重归于好,2020-01-08
1668,老婆彻底死心？学会这4步让她主动求复合,2020-01-12
1667,好的婚姻，是有了老婆忘了妈,2019-12-30
1666,高难度婚姻情感修复，一招决胜挽回死心的她,2019-12-10
1665,原来，夫妻关系竟然这么势利！,2020-01-01
1664,女生最喜欢的被撩方式，让她对你言听计从,2019-12-09
1663,婚姻摇摇欲坠？教你“3招”绝命反击,2019-12-29
1662,亲密关系7大杀手，你中枪了几条？,2020-01-12
1661,结婚就能白头偕老？别逗了,2019-12-17
1660,婚姻中最破坏关系的这4种行为，你家有吗？,2019-12-09
1659,向别人要幸福，正是不幸的开始,2019-12-22
1658,牢记这几点，快速修复破碎的婚姻！,2020-01-11
1657,挽回死心的妻子，居然要知道这些！,2020-01-22
1656,夫妻如何相处才能久处不厌,2020-01-10
1655,想谈场不分手的恋爱？聪明男人都这么做！,2020-01-10
1654,这六点教你如何维持破碎的婚姻,2020-01-09
1653,别因为我适合做妻子，才娶我！,2020-01-18
1652,共苦却不能同甘的我们，最终还是成了陌路夫妻,2019-12-29
1651,致前夫的一封信：当我们已不再年轻……,2019-12-11
1650,夫妻间互不体谅？不如来玩一次“角色扮演”,2020-01-05
1649,为什么领证以后，你就不爱我了？,2019-12-10
1648,婚姻的至高境界不是如胶似漆，是不累,2020-01-15
1647,4招修复婚姻难题，让你再次成为她的“心头爱”,2020-01-03
1646,最逆天的婚姻修复技巧，句句说到心坎上！,2019-12-12
1645,一招瓦解婚姻难题，让你重新赢得爱人的心,2020-01-22
1644,婚姻支离破碎？教你“1招”绝地反转,2020-01-06
1643,挽救婚姻的4个绝招，让濒死的感情破镜重圆,2019-12-08
1642,幸福婚姻遭遇冷暴力，一招让她乖乖重新主动求和,2020-01-19
1641,4个狠招拯救破碎婚姻，让她这辈子非你不可！,2019-12-14
1640,一招逆转分手死局，快速修复破碎的婚姻,2019-12-10
1639,幸福化为泡沫，走入绝境的婚姻该怎么挽回？,2019-12-18
1638,一招破解婚姻难题，把她冰冷的心暖回来！,2019-12-17
1637,面对绝情的她，一招快速修复破碎的婚姻,2019-12-10
1636,婚后三五年，最能看出男人的品性,2020-01-05
1635,"签下“不忠协议”,女作家的爱情保鲜计划惨败而归",2020-01-20
1634,娶娇妻与前妻斗气，千万富豪屡屡“被虐”可笑可悲！,2019-12-24
1633,学会这三招，助你力挽狂澜挽回她的心,2019-12-31
1632,“攻心为上”，一招瓦解婚姻难题！,2019-12-23
1631,催婚是一群人的狂欢，离婚是一个人的孤单,2019-12-28
1630,只许老年人挑儿媳？挑公婆也有一条鄙视链！,2020-01-21
1629,有格局的男人，才撑得起婚姻,2020-01-18
1628,写给未婚女孩的21个小秘密,2019-12-13
1627,一定要找一个愿意陪你聊天的人结婚,2019-12-18
1626,能把婚姻经营好，你的人生就成功了大半,2019-12-15
1625,她说,2019-12-25
1624,一招挽救婚姻难题，让绝情的她哭着回来！,2019-12-25
1623,挽回婚姻，不得不看的三大绝招！,2019-12-28
1622,婚姻遇冷？“六步”教你绝地反转,2019-12-22
1621,这样聊天，女生会对你意乱情迷,2020-01-02
1620,没有出轨，婚姻也会生老病死！,2019-12-18
1619,濒临破碎的婚姻，被我用这招“绝地大反转”,2019-12-18
1618,婚姻破裂？第一视角让你破镜重圆,2020-01-17
1617,万万没想到！竟是这些小事毁了无数人的婚姻！,2020-01-17
1616,性压抑的婚姻有多惨？口碑爆棚的《白鹿原》里有答案！,2019-12-23
1615,从婚外情到离婚共有三步，请在第一步就阻止,2020-01-19
1614,婚姻过不好，抱怨父母有用吗？,2020-01-10
1613,嫁给一个“妈宝男”到底有多可怕？,2019-12-29
1612,嫁给这三种男人，婚姻还有救吗？,2020-01-07
1611,她做了78年的剩女，最后嫁给自己的初恋，她说：不管多晚，都要嫁给爱情,2020-01-14
1610,看似稳定的婚姻，并不代表真的过得好,2019-12-30
1609,吵架后，怎样做能让对方瞬间原谅你?,2019-12-26
1608,婚姻好不好，身体会知道,2019-12-09
1607,一剂“独立”的药方，就能包治全职太太的高危病？,2019-12-27
1606,大S：掌控人生主动权，才是真女神,2019-12-16
1605,5个故事告诉你：那些不得不知的婚姻真相,2020-01-18
1604,没有了性生活，婚姻何以为继,2019-12-27
1603,分手前性爱告别，我们的婚姻起死回生,2019-12-18
1602,婚后床上不和谐，少妇出轨痴情律师,2019-12-24
1601,“达康书记”的爱情：妻子把我从龙套君变成“影帝”,2019-12-12
1600,三段婚姻故事：别让你的婚姻将错就错,2019-12-28
1599,为什么有些婚姻坏在小事上，有些却能挺过大风浪,2020-01-11
1598,妈妈有主见，对一个家有多重要,2020-01-16
1597,选对了婚姻，选错了关系……那就悲剧了！,2019-12-28
1596,小S ：“我知道婚姻很难，可我希望你们撑到最后。”,2019-12-30
1595,昆凌二胎喜产子：嫁给一个舍得爱你的男人有多重要,2019-12-10
1594,嫁给人品，不要嫁给爱情,2020-01-06
1593,为什么越是普通女孩，越不应该满足“嫁给有钱人”的人生？,2019-12-11
1592,没有爱情的婚姻，都是功利的！,2019-12-19
1591,好的婚姻，是一次次重新爱上的过程,2020-01-18
1590,《我的前半生》：婚姻是一袭华美的袍，上面爬满了虱子,2019-12-10
1589,你以为的不般配，往往都是最登对的,2019-12-10
1588,宋仲基和宋慧乔结婚得到全天下的祝福，为什么霍建华和林心如结婚，却一直有人唱衰？,2019-12-09
1587,做爱人，更要做家庭的合伙人,2019-12-27
1586,好婚姻让你绚烂，坏婚姻让你腐烂,2019-12-20
1585,94岁杨振宁遗产分配：坚守13年，翁帆你到底图什么？,2019-12-09
1584,那些年轻时候很“作”的女孩，后来都活成了什么样？,2019-12-21
1583,婚姻里出现婚外情的几个表现,2019-12-12
1582,连生三胎的吴佩慈：怎样把漂亮人生过成奇葩说,2020-01-21
1581,这样聊天，只会把爱人越推越远,2019-12-10
1580,89年小夫妻爆改600㎡破农房，上演现实版《小森林》,2019-12-29
1579,为什么你无论和谁相爱，都那么累？,2019-12-17
1578,因为爱你，我变成了幼稚鬼,2020-01-10
1577,离婚不会穷三代，但纠结可能毁一生,2020-01-20
1576,做好这3件事，你的婚姻会越走越顺,2019-12-10
1575,大部分破裂的婚姻里，都有一个假装无私的人,2020-01-17
1574,闪婚、辞职，80后小夫妻“私奔”5.8万公里，你敢吗？,2019-12-26
1573,失败的婚姻里，最大的问题不是出轨，而是……,2019-12-28
1572,为什么有的人有了伴侣以后还聊骚？,2020-01-08
1571,婚后，遇到两情相悦的人该怎么办？,2019-12-21
1570,杭州保姆纵火案：愿每一次遇见，都是彼此的恩赐,2019-12-20
1569,别用“分手”来学会这些恋爱教训,2019-12-26
1568,女孩子嫁错人有多可怕？,2019-12-11
1567,婚姻好不好，就看你们怎么吵,2020-01-16
1566,婚姻不易，不要轻易说爱，也不要轻易说散,2020-01-13
1565,杨绛：会聊天的原生家庭，才能过有趣的一生,2020-01-01
1564,已婚少妇吐槽录,2020-01-12
1563,我们也是做了父母之后，才知道自己是什么样的人,2019-12-30
1562,校花的婚姻为何往往不太顺利？,2020-01-04
1561,好的前任，分手后就应该像死了一样,2020-01-11
1560,和另一半相处，“会闭嘴”比“会说话”更重要,2019-12-22
1559,他配不配做你男朋友，约一次会就知道了,2019-12-30
1558,婚姻生活和不和谐，嘴上功夫很重要,2019-12-29
1557,除了情和爱，婚姻中的我们还可以谈什么？,2020-01-05
1556,八旬夫妻穷游20国，把迟暮活出早春的模样,2020-01-21
1555,最怕一生未见爱情，却骗自己婚姻真好！,2020-01-04
1554,什么样的女人会让男人上瘾一辈子？,2020-01-08
1553,能拯救你的，从来都不是离婚,2020-01-15
1552,男人最怕老婆问这10个问题，排名第一的竟然是…,2020-01-04
1551,不要只在微信里谈恋爱,2020-01-13
1550,结一次不失望的婚到底有多难？,2020-01-14
1549,把感情经营好，这8个要点一定要牢记,2020-01-15
1548,远离身边的“暖男婊”,2019-12-12
1547,你为什么遇不见好的爱情？,2019-12-12
1546,祝你新婚快乐！,2020-01-08
1545,老婆怀孕期间，男人除了出轨还能干点什么？,2019-12-30
1544,婚姻里，最不该穷养的是妻子,2020-01-04
1543,春娇救志明：恋爱想谈得开心太难了，但我依旧想爱你,2020-01-16
1542,越为你付出的男人，越不会离开你,2019-12-07
1541,男人愿意为了谈恋爱花多少钱？,2019-12-25
1540,为什么越来越多的姑娘不愿意结婚？,2019-12-13
1539,婚姻最大危机：外面胡吹海侃，回家无话可聊,2019-12-07
1538,结婚是我目前人生中最美好的事,2019-12-21
1537,论女明星豪门梦的碎掉,2019-12-08
1536,有什么失恋是不能靠新欢解决的呢？,2019-12-27
1535,我老婆没有工作（刷爆整个朋友圈）,2020-01-10
1534,精明俗气的刘嘉玲是梁朝伟最不文艺的一次选择……,2019-12-17
1533,无性无爱41年，朱安到底拥有怎样死寂枯槁的人生？,2020-01-17
1532,远离你身边的“道德婊”,2019-12-18
1531,宋慧乔宋仲基订婚啦：更好的我们，才能遇见更好的爱,2019-12-21
1530,一个人值不值得交往，看他被诋毁后的模样,2019-12-29
1529,我随便结了个婚,2020-01-18
1528,秀恩爱并不可耻，装单身才有损失,2020-01-06
1527,有趣的高晓松和无趣的吴彦祖，结婚你选谁？,2020-01-07
1526,你怎么看嫁给有钱人？美国华裔女子亲身讲述婚姻与金钱,2019-12-27
1525,从校园到婚姻，从租房到买房，从装修到美翻朋友圈……只要相爱，日子总会越来越好,2020-01-17
1524,所谓白头偕老，就是这样炼成的吧,2020-01-13
1523,这样养孩子，比穷养更悲哀,2019-12-08
1522,明明过不下去了，我却不敢离婚,2020-01-12
1521,夫妻关系和亲子关系的次序，99% 的中国人都搞错了,2020-01-06
1520,婚姻真相：你是谁，就会遇见谁,2019-12-18
1519,210天爱爱计划，我治好了丈夫的性恐慌,2020-01-09
1518,嫁给一个懂得好好说话的家庭有多重要,2019-12-17
1517,爱上A片男优，纯情少妇深陷”桃色陷阱“,2019-12-15
1516,绝望主妇遭遇调情障碍，枕边“哑巴”如何情话绵绵？,2020-01-03
1515,挽回婚姻，只需要掌握这三点,2019-12-13
1514,为什么现在的男生都不追女生了？,2019-12-27
1513,没有好好浪过的姑娘，驾驭不了后半生,2020-01-20
1512,男人最高级的炫富：我有时间陪老婆,2020-01-18
1511,婚姻里，一切都要向对方坦白吗？,2020-01-17
1510,婚姻亮起红灯？那是因为你没有掌握这3招！,2019-12-22
1509,婚姻出现危机？看我用3招帮你解决,2020-01-08
1508,不得不看的挽回禁区！看完绝对让你扳回一成,2019-12-11
1507,面对婚姻破裂时，我们应该这样做,2020-01-04
1506,99%挽回婚姻率，“5”招让绝情的她主动和你在一起一辈子,2020-01-12
1505,她绝情和你分手，我们应该这样做才能挽回她！,2019-12-24
1504,一招逆转婚姻死局，让绝情的她奋不顾身主动挽回你！,2020-01-19
1503,分手以后，我们终将治愈受伤的自己,2019-12-25
1502,难忍夺夫之恨， 网络偷窥能否追回逝去的爱？,2019-12-13
1501,另一半出轨是因为真爱吗？,2020-01-15
1500,“1”招逆转婚姻死局，挽回死心的她,2019-12-25
1499,“出轨只有零次和无数次”，这句话害了多少人！,2019-12-08
1498,听完这4个故事还想离婚，那就离吧,2019-12-24
1497,天朝妇联：男人的嘴，骗人的鬼,2020-01-09
1496,最终能让男人上瘾的，永远是这类女人,2019-12-16
1495,婚姻中双方最大的伤害不是不爱了，而是......,2019-12-14
1494,80%的婚姻危机，都是金钱造成的问题,2019-12-17
1493,恋爱的秘密武器——“示弱”,2019-12-27
1492,逆袭最重要的技能：比颜值更性感的，是你的魅力,2019-12-21
1491,林徽因：民国情感女神，如何被三个男人宠爱一生？,2020-01-20
1490,90%的感情都会遭遇的困境，只是因为不知道这一点..,2020-01-20
1489,谈恋爱时的不安全感如何克服？,2019-12-22
1488,男人不会回应只会逃跑的爱情是什么样的,2019-12-15
1487,贾静雯！为什么可以嫁的那么好？,2019-12-19
1486,别人家的男朋友是怎么来的？,2020-01-19
1485,如何调教内向没有情调的伴侣？,2020-01-16
1484,感情里的安全感是怎么来的,2019-12-21
1483,婚姻最幸福的状态，不仅仅是陪伴，而是不变的爱。,2019-12-30
1482,你和ta是哪种类型？怎么从根源解决问题,2019-12-16
1481,彼此依赖又相互独立 才是最好的爱情模式,2019-12-12
1480,嫁给妈宝男，离婚是唯一的出路吗？,2019-12-26
1479,3个故事告诉你：家庭关系里，守住界限有多重要,2020-01-04
1478,梁朝伟刘嘉玲：不被看好，为什么能恩爱如初？,2020-01-12
1477,孩子遭遇校园欺凌，美国妈妈怎么做？,2020-01-14
1476,哪有什么岁月静好，只不过是彼此懂得珍惜,2019-12-12
1475,几张图告诉你，无话可说的婚姻有多可怕？,2019-12-25
1474,别扯了，司马懿根本就是个贱男！,2020-01-21
1473,怎么才能让女友不会在乎物质生活和你在一起呢,2019-12-30
1472,何猷君求婚奚梦瑶：姐弟恋应该这样维持,2019-12-23
1471,做更好的自己的才能过得更好,2019-12-21
1470,你给我安全感使我选择了坦白,2019-12-28
1469,爱和喜欢到底是怎么区分的,2019-12-10
1468,一个男的对你爱不爱就看这两个字,2020-01-13
